{
  "schemaVersion": 1,
  "title": "Philip Morris International",
  "subject": {
    "name": "Philip Morris International",
    "kind": "company",
    "url": "https://www.pmi.com/"
  },
  "tagline": "PMI says it is building a future without cigarettes. This map sets that vision beside what regulators, health bodies and its own numbers show.",
  "root": "pmi",
  "credit": "An independent StoryTeller study.",
  "disclaimer": "Built from PMI’s public website, FDA and WHO statements, and independent analysis from Tobacco Tactics (University of Bath). PMI’s own figures are shown as PMI’s claims. Not affiliated with or endorsed by Philip Morris International.",
  "generated": {
    "date": "2026-10-02"
  },
  "clusters": [
    {
      "id": "origins",
      "label": "Origins & structure"
    },
    {
      "id": "cigarettes",
      "label": "Marlboro & cigarettes"
    },
    {
      "id": "pivot",
      "label": "The smoke-free pivot"
    },
    {
      "id": "products",
      "label": "Products & science"
    },
    {
      "id": "oversight",
      "label": "Regulators & health bodies"
    },
    {
      "id": "deals",
      "label": "Deals"
    },
    {
      "id": "scrutiny",
      "label": "Scrutiny"
    }
  ],
  "sources": [
    {
      "id": "ms",
      "title": "Key milestones",
      "url": "https://www.pmi.com/who-we-are/key-milestones",
      "publisher": "Philip Morris International",
      "accessed": "2026-10-02"
    },
    {
      "id": "vision",
      "title": "Our smoke-free vision",
      "url": "https://www.pmi.com/our-progress/our-smoke-free-vision",
      "publisher": "Philip Morris International",
      "accessed": "2026-10-02"
    },
    {
      "id": "progress",
      "title": "Our progress",
      "url": "https://www.pmi.com/our-progress",
      "publisher": "Philip Morris International",
      "accessed": "2026-10-02"
    },
    {
      "id": "reg",
      "title": "Our views: Regulation",
      "url": "https://www.pmi.com/who-we-are/our-views-and-standards/our-views/regulation",
      "publisher": "Philip Morris International",
      "accessed": "2026-10-02"
    },
    {
      "id": "health",
      "title": "Our views: Health effects of smoking and tobacco use",
      "url": "https://www.pmi.com/who-we-are/our-views-and-standards/our-views/health-effects-of-smoking-tobacco",
      "publisher": "Philip Morris International",
      "accessed": "2026-10-02"
    },
    {
      "id": "heated",
      "title": "Heated tobacco products",
      "url": "https://www.pmi.com/our-business/smoke-free-products/heated-tobacco-products",
      "publisher": "Philip Morris International",
      "accessed": "2026-10-02"
    },
    {
      "id": "oral",
      "title": "Oral smokeless products",
      "url": "https://www.pmi.com/our-business/smoke-free-products/oral-smokeless-products",
      "publisher": "Philip Morris International",
      "accessed": "2026-10-02"
    },
    {
      "id": "science",
      "title": "PMI’s science & research on smoke-free products",
      "url": "https://www.pmi.com/our-science",
      "publisher": "Philip Morris International",
      "accessed": "2026-10-02"
    },
    {
      "id": "youth",
      "title": "Preventing youth use of our products",
      "url": "https://www.pmi.com/our-business/preventing-youth-access",
      "publisher": "Philip Morris International",
      "accessed": "2026-10-02"
    },
    {
      "id": "transp",
      "title": "Transparency",
      "url": "https://www.pmi.com/who-we-are/our-views-and-standards/standards/transparency",
      "publisher": "Philip Morris International",
      "accessed": "2026-10-02"
    },
    {
      "id": "lead",
      "title": "Our leadership team",
      "url": "https://www.pmi.com/who-we-are/our-leadership-team",
      "publisher": "Philip Morris International",
      "accessed": "2026-10-02"
    },
    {
      "id": "fda19",
      "title": "FDA permits sale of IQOS Tobacco Heating System through premarket tobacco product application pathway",
      "url": "https://www.fda.gov/news-events/press-announcements/fda-permits-sale-iqos-tobacco-heating-system-through-premarket-tobacco-product-application-pathway",
      "publisher": "US Food and Drug Administration",
      "accessed": "2026-10-02"
    },
    {
      "id": "fdaiqos22",
      "title": "FDA Authorizes Reduced Exposure Claim for IQOS 3 System Holder and Charger",
      "url": "https://www.fda.gov/tobacco-products/ctp-newsroom/fda-authorizes-reduced-exposure-claim-iqos-3-system-holder-and-charger",
      "publisher": "US Food and Drug Administration",
      "accessed": "2026-10-02"
    },
    {
      "id": "who20",
      "title": "WHO statement on heated tobacco products and the US FDA decision regarding IQOS",
      "url": "https://www.who.int/news/item/27-07-2020-who-statement-on-heated-tobacco-products-and-the-us-fda-decision-regarding-iqos",
      "publisher": "World Health Organization",
      "accessed": "2026-10-02"
    },
    {
      "id": "fdazyn",
      "title": "FDA Authorizes 20 ZYN Nicotine Pouches to Be Marketed with Specific Modified Risk Claim",
      "url": "https://www.fda.gov/tobacco-products/ctp-newsroom/fda-authorizes-20-zyn-nicotine-pouches-be-marketed-specific-modified-risk-claim",
      "publisher": "US Food and Drug Administration",
      "accessed": "2026-10-02"
    },
    {
      "id": "tt",
      "title": "Philip Morris International (Tobacco Tactics)",
      "url": "https://www.tobaccotactics.org/article/philip-morris-international/",
      "publisher": "Tobacco Control Research Group, University of Bath",
      "accessed": "2026-10-02"
    },
    {
      "id": "wpmi",
      "title": "Philip Morris International (Wikipedia)",
      "url": "https://en.wikipedia.org/wiki/Philip_Morris_International",
      "publisher": "Wikipedia",
      "accessed": "2026-10-02"
    },
    {
      "id": "wmarl",
      "title": "Marlboro (cigarette) (Wikipedia)",
      "url": "https://en.wikipedia.org/wiki/Marlboro_(cigarette)",
      "publisher": "Wikipedia",
      "accessed": "2026-10-02"
    },
    {
      "id": "wfsfw",
      "title": "Foundation for a Smoke-Free World (Wikipedia)",
      "url": "https://en.wikipedia.org/wiki/Foundation_for_a_Smoke-Free_World",
      "publisher": "Wikipedia",
      "accessed": "2026-10-02"
    }
  ],
  "nodes": [
    {
      "id": "pmi",
      "title": "Philip Morris International",
      "type": "company",
      "cluster": "pivot",
      "featured": true,
      "summary": "The cigarette maker that sells Marlboro outside the US and says its purpose is now to replace cigarettes with smoke-free alternatives.",
      "details": "Headquartered in Stamford, Connecticut, with its operations centre in Lausanne. Tobacco Tactics, citing Euromonitor, puts its share at around 23% of the global cigarette market outside China in 2025.",
      "evidence": "approximately 84,900 employees",
      "sources": [
        "transp",
        "ms",
        "tt"
      ],
      "themes": [
        "company"
      ]
    },
    {
      "id": "bond-street",
      "title": "Bond Street shop, 1847",
      "type": "event",
      "cluster": "origins",
      "summary": "The company’s own account of where it starts: a tobacconist’s shop in London, long before the US cigarette brands.",
      "evidence": "Mr. Philip Morris opens a shop on London's Bond Street, selling tobacco and ready-made cigarettes.",
      "when": "1847",
      "start": "1847",
      "sources": [
        "ms"
      ],
      "themes": [
        "history"
      ]
    },
    {
      "id": "philip-morris-cos",
      "title": "Part of Philip Morris Cos.",
      "type": "event",
      "cluster": "origins",
      "summary": "PMI began as the international operating arm of a US parent, which later renamed itself Altria.",
      "details": "Wikipedia notes the parent changed its name to Altria Group in 2003.",
      "evidence": "PMI is incorporated as an operating company of Philip Morris Companies Inc.",
      "when": "1987",
      "start": "1987",
      "sources": [
        "ms",
        "wpmi"
      ],
      "themes": [
        "structure"
      ]
    },
    {
      "id": "lausanne",
      "title": "Lausanne operations centre",
      "type": "place",
      "cluster": "origins",
      "summary": "PMI moved its operations centre from the US to Switzerland, where it still runs global operations.",
      "evidence": "PMI operations center is transferred from Rye Brook, NY (U.S.) to Lausanne, Switzerland.",
      "when": "2001",
      "start": "2001",
      "sources": [
        "ms",
        "tt"
      ],
      "themes": [
        "structure"
      ]
    },
    {
      "id": "altria-spin",
      "title": "Spun off from Altria, 2008",
      "type": "event",
      "cluster": "origins",
      "featured": true,
      "summary": "PMI became an independent public company, leaving the US cigarette business with Altria and taking the rest of the world.",
      "details": "Tobacco Tactics, citing an Associated Press report, says the split let PMI clear the international business from the legal and regulatory constraints facing the US one.",
      "evidence": "In March 2008, PMI was spun off from Altria and has been an entirely separate entity since then.",
      "when": "March 2008",
      "start": "2008-03",
      "sources": [
        "wpmi",
        "tt"
      ],
      "themes": [
        "structure"
      ]
    },
    {
      "id": "marlboro-brand",
      "title": "Marlboro",
      "type": "brand",
      "cluster": "cigarettes",
      "featured": true,
      "summary": "The flagship cigarette brand. PMI sells it everywhere except the US, where Altria’s Philip Morris USA does.",
      "details": "Tobacco Tactics says Marlboro is the biggest-selling cigarette brand in the international market.",
      "evidence": "Marlboro, which went on to become the company’s most famous brand, is established and registered as a trademark.",
      "when": "1908 (PMI’s date)",
      "start": "1908",
      "sources": [